,tweet_id,author_id,inbound,created_at,text,response_tweet_id,in_response_to_tweet_id,date,category_raw,category,complaint_category_raw
202,603647,261648,True,Sun Dec 03 22:37:37 +0000 2017,So @Delta still with Mechanical issues on flt1918. Now we’re racing from SNA to LAX by #Uber to catch new flight hoping to arrive tonight. @28132 @28133 @263443,603646,,2017-12-03,complaint,flight delays,Flight Delays
206,603633,263441,True,Sun Dec 03 22:35:18 +0000 2017,I had a great time flying with @Delta to Singapore/Japan/HK but now I am GOLD ELITE and my husband isn’t #divorce @28130,"603632,603634",,2017-12-03,complaint,other,Other.
210,603627,263438,True,Sun Dec 03 22:31:27 +0000 2017,@Delta answer me. Why is this a policy to take pictures of passengers before they board a flight to Ghana?!  Why is this ok? #DeltaAirlines,603626,,2017-12-03,complaint,flight booking problems,Flight Booking Problems
212,603623,263436,True,Sun Dec 03 22:52:29 +0000 2017,@Delta What’s going on here?? On hold for 20 mins.  Nice service. https://t.co/EJlx3yMouL,603622,,2017-12-03,complaint,poor customer service,Category: Poor Customer Service
213,602877,263168,True,Sun Dec 03 21:56:22 +0000 2017,"@Delta I’ve been in Pittsburg all weekend for work, we ended early and I’m trying to fly out on 5:45. I’m booked on the 6:45, hoping arrive early and have a little Sunday without paying $75 change fee!!? The flight before us is wide open! Doesn’t make sense!",602876,,2017-12-03,complaint,flight booking problems,Flight Booking Problems
214,602873,263167,True,Sun Dec 03 22:08:38 +0000 2017,@Delta very disappointed in your new Economy Basic fare class. I am sitting in SLC right now trying to move to an earlier flight to SEA. There are seats available on the earlier flight and I would pay $100 extra to change flights but I can't because of this fare class. Help!!,602872,,2017-12-03,complaint,flight booking problems,Flight Booking Problems
216,602869,263165,True,Sun Dec 03 22:03:20 +0000 2017,Flight from ROC to LGA. App says 5:15pm departure with arrival of 6:47pm. We board plane and captain says the flight time is 45 minutes. Why you lying? 🤥 @Delta,602868,,2017-12-03,complaint,flight delays,Category: Flight Delays
218,602864,263164,True,Sun Dec 03 22:08:35 +0000 2017,"@Delta The condition of aircraft on Flight #483 today from JFK to SFO is unacceptable. Between the putrid smell, lack of in seat power, and ancient IFE and overall condition. This is not acceptable for a 6.5 hour flight.",602863,,2017-12-03,complaint,bad flight experience,Category: Bad Flight Experience.
222,598583,261943,True,Sun Dec 03 20:01:39 +0000 2017,@Delta Disappointed with delta online reservation. I always get an error with fare change after selecting the dates and submitting the payment. Looks like there is no sync between showing prices and booking flights.,598582,,2017-12-03,complaint,flight booking problems,Flight Booking Problems
230,594117,260725,True,Sun Dec 03 18:16:04 +0000 2017,@Delta flight1287 from Miami to LaGuardia smells awful. We just boarded. It’s really really bad.,594116,,2017-12-03,complaint,bad flight experience,Category: Bad Flight Experience.
234,594127,260729,True,Sun Dec 03 18:08:51 +0000 2017,@Delta I need help ASAP! My daughters are stuck at LGA and the desk person is not helping! Please DM me,"594126,594128",,2017-12-03,complaint,poor customer service,Category: Poor Customer Service
236,594132,260731,True,Sun Dec 03 18:02:12 +0000 2017,Usually a fan of @Delta but not today. Extremely frustrating.,594131,,2017-12-03,complaint,other,"Category: Other. 

The tweet does not provide enough information to classify the complaint into any of the given categories."
238,594138,260733,True,Sun Dec 03 17:56:45 +0000 2017,"@Delta Bought tickets together, checking in, husband’s seat upgraded to Delta Comfort &amp; mine changed. Tried calling, 2 hour wait. How can we fix this to sit together?",594136,,2017-12-03,complaint,flight booking problems,Flight Booking Problems
239,595244,261046,True,Sun Dec 03 18:49:39 +0000 2017,Calling about my flight which takes off in less than two hours but they’re not gonna call me back for two hours? @Delta  that makes no sense.  I’ve never had an airline say it was going to take that long to answer question,595243,,2017-12-03,complaint,poor customer service,Category: Poor Customer Service
245,598576,261940,True,Sun Dec 03 20:22:57 +0000 2017,Beyond annoyed with @Delta and their lack of customer service.... 🙄 about to cut up this Amex and quit flying w/ them,598575,,2017-12-03,complaint,poor customer service,Poor Customer Service.
250,591647,259998,True,Sun Dec 03 17:20:53 +0000 2017,Our @Delta plane has a leak so it’s time to deplane. People r frustrated but wouldn’t u rather learn of this on the ground than in the air?,591646,,2017-12-03,complaint,flight delays,Category: Flight Delays.
252,591651,259999,True,Sun Dec 03 17:16:26 +0000 2017,@Delta thank you for making me sleep at the airport #RockBottom,591650,,2017-12-03,complaint,flight delays,Category: Flight Delays.
254,591659,260001,True,Sun Dec 03 17:18:04 +0000 2017,You guys suck @Delta,591657,,2017-12-03,complaint,poor customer service,Category: Poor Customer Service.
257,591665,260004,True,Sun Dec 03 17:07:05 +0000 2017,"@Delta Never fly delta! I can't change my flight due to an emergency, even though I bought insurance...",591664,,2017-12-03,complaint,flight booking problems,Flight Booking Problems
258,595248,261047,True,Sun Dec 03 18:37:18 +0000 2017,@Delta I ❤️ U but...On a flight to NYC from MIA (DL1287). Smells like a dozen used diapers filled w/ 💩 INSIDE of this airplane. The flight attendants say there’s nothing they can do. I just hope I don’t smell like 💩 once we land. Help!,595247,,2017-12-03,complaint,bad flight experience,Category: Bad Flight Experience.
260,597403,261640,True,Sun Dec 03 19:47:35 +0000 2017,"After @Delta rebooks me, I get put on the @VirginAtlantic flight. I thought it’s delayed, but I should still get to Bangalore in time for my events and that layover should be enough time. Then I get to the airport and the flight attendants tell me we will BOARD at 6:45pm instead.","597402,597404",,2017-12-03,complaint,flight delays,Category: Flight Delays.
262,597387,183666,True,Sun Dec 03 19:51:39 +0000 2017,@2838 why do you only have one bus on Friday night for ALL terminals but less busy Sunday two separate routes?  Pain in the ass to arrive on @Delta at night and have to go @140483 via all terminals and the T. @211.,597385,,2017-12-03,complaint,,Flight Experience - Inconvenient airport transportation.
265,597399,261644,True,Sun Dec 03 19:45:28 +0000 2017,Had to fly American today instead of @Delta and I hated it,597398,,2017-12-03,complaint,bad flight experience,Category: Bad Flight Experience.
269,597382,261641,True,Sun Dec 03 19:36:32 +0000 2017,@delta you board the entire flight then deplane due to a smell that was present before boarding. Told everyone to reboook their flights and your “VIP” phone rep hangs up on me whole trying to do so. Not how you should treat #loyal #medallion #members #fail,597381,,2017-12-03,complaint,bad flight experience,"Reason for complaint: Bad Flight Experience
Category: Flight Boarding Problems"
272,597430,176544,True,Sun Dec 03 19:39:28 +0000 2017,@Delta Lousy service today. Flight #1710,597428,,2017-12-03,complaint,poor customer service,Category: Poor Customer Service.
273,597437,261647,True,Sun Dec 03 19:26:56 +0000 2017,"@Delta disappointed in you guys today, of all my flights with delta never had a screw up like this one, and can’t get any help either. Guess 2018 I’ll be picking a new airline to fly with.",597436,,2017-12-03,complaint,poor customer service,Category: Poor Customer Service
274,595252,261049,True,Sun Dec 03 18:37:08 +0000 2017,"@Delta Hey man, listen, I understand cancelling a flight because the plane is broken, but when you rebook me, can't you do something to ensure I get the same seats I chose? I choose the aisles because I'm a big person, not because I think it's cool.",595251,,2017-12-03,complaint,flight cancellation,Category: Flight Cancellation
279,597374,261639,True,Sun Dec 03 19:56:13 +0000 2017,Waiting 90 minutes to get a boarding pass for our infant. No reason provided. No ETA. Flight at 1:30 to NL. @Delta,597372,,2017-12-03,complaint,flight booking problems,Flight Booking Problems
282,596366,261335,True,Sun Dec 03 19:10:20 +0000 2017,"@Delta your maintenance response for issues in Grand Rapids is ridiculous. 2.5 hours we’ve been waiting for them to even GET HERE, let alone fix the issue. While we sit and wait and watch our boarding time get pushed further and further back 😡",596365,,2017-12-03,complaint,flight delays,Category: Flight Delays
285,596362,229770,True,Sun Dec 03 19:10:18 +0000 2017,"@Delta, this #LittleWifeBigLife usually sings your praises after one of my many trips with my girls. Today, however, I encountered a very rude stewardess by the name of Heather on DL2898 and I'm extremely disappointed in the service. I'm filing an official complaint online.",596360,,2017-12-03,complaint,flight attendant complaints,Flight Attendant Complaints
286,597376,261640,True,Sun Dec 03 19:52:26 +0000 2017,"Then once I land and miss my connecting flight, I go to the ticketing counter and ask for a new ticket. Clifton from @VirginAtlantic helpfully tells me it’s his first day and he can’t help me much and just told me to go to the gate on the ticket. @Delta is nowhere to be found.",597375,,2017-12-03,complaint,flight booking problems,Flight Booking Problems
291,530923,242969,True,Sat Dec 02 06:01:47 +0000 2017,How is it that I bought my ticket 2 months ago and checked in 24hrs in advance on the dot and I’m still in the last boarding group 🙄🙄🙄 @Delta,530922,,2017-12-02,complaint,flight booking problems,Flight Booking Problems.
293,532752,243414,True,Sat Dec 02 10:36:38 +0000 2017,@Delta we r stuck in Budapest. Need to get back to USA ASAP. Please help,532749,,2017-12-02,complaint,flight delays,Category: Flight Delays
294,531779,243196,True,Sat Dec 02 10:21:14 +0000 2017,"@Delta after you updated your app yesterday, it won't open and I have a flight tomorrow. This sucks. https://t.co/JYtloZicUH",531777,,2017-12-02,complaint,flight booking problems,Flight Booking Problems
295,533579,159235,True,Sat Dec 02 11:44:50 +0000 2017,@Delta You should fix the boarding Zone glitch when getting Upgraded at the gate. Should have changed from Sky to PREM. https://t.co/ZgcnXzS3k1,533578,,2017-12-02,complaint,flight booking problems,Flight Booking Problems
298,525065,241436,True,Sat Dec 02 05:20:53 +0000 2017,I now know why @Delta ‘s nickname is Don’t Ever Leave The Airport. #NeverAgain,525064,,2017-12-02,complaint,bad flight experience,Category: Bad Flight Experience.
299,533588,243600,True,Sat Dec 02 11:38:40 +0000 2017,"@Delta Was just told we had to stand in a line for 30 MINUTES. The ceiling has actual duct tape holding it up, but we have to stand under it.",533586,,2017-12-02,complaint,bad flight experience,Category: Bad Flight Experience.
303,534636,243600,True,Sat Dec 02 12:13:12 +0000 2017,I can't believe I paid for this. Now being subjected to thumping club music. Is this a reality show @Delta? Is someone going to ask for a release for the footage of this abuse? Because this customer is not amused.,534635,,2017-12-02,complaint,bad flight experience,Category: Bad Flight Experience.
307,535335,244028,True,Sat Dec 02 12:42:46 +0000 2017,"@Delta on DL44 JFK to DUB last night, one of our bags didn’t make the flight. Called bag service line they provided zero help and laughed at us, can you assist??",535334,,2017-12-02,complaint,lost/damaged luggage,Lost/Damaged Luggage.
310,526286,241775,True,Sat Dec 02 06:31:26 +0000 2017,So far @Delta has canceled my flight to Thailand not once but TWICE!!!!! I leave in 48 Days!!!! What is someone at delta going to do?,526285,,2017-12-02,complaint,flight cancellation,Category: Flight Cancellation
313,525060,241434,True,Sat Dec 02 05:40:12 +0000 2017,@Delta - they are beyond terrible. https://t.co/QeqWnNAm7X,"525059,525061",,2017-12-02,complaint,poor customer service,Category: Poor Customer Service.
314,525732,241635,True,Sat Dec 02 06:10:45 +0000 2017,@Delta 0/10 for how your crew treated an elderly woman on my flight. @AmericanAir sorry for cheating my boss made me take this flight. Never again!,525731,,2017-12-02,complaint,bad flight experience,Bad Flight Experience.
315,525741,241637,True,Sat Dec 02 05:58:30 +0000 2017,Hey @Delta! Not at all mad the flight had to turn around but we're getting mixed info from the gate agents! Help 🙏,"525740,525742",,2017-12-02,complaint,flight delays,Category: Flight Delays
316,525752,172332,True,Sat Dec 02 05:54:09 +0000 2017,just when you thought discount airlines were the worst @Delta delivers worst service,525749,,2017-12-02,complaint,poor customer service,Category: Poor Customer Service
320,524377,241239,True,Sat Dec 02 05:09:22 +0000 2017,"Holy crap @824, I’ve never seen an airline jack the price up in just the time it took me to pick my seats and enter my payment info in. That’s incredible ... https://t.co/vFqDPf02v4",524376,,2017-12-02,complaint,flight booking problems,Flight Booking Problems
321,526288,241776,True,Sat Dec 02 06:29:56 +0000 2017,"When you’ve got status with @delta and book with your KTN then you go to check in and somehow it disappears. 😡 and the desk agents don’t know how to add it on. 😡 this needs to be fixed for the return. Ugh. 

#HellNo",526287,,2017-12-02,complaint,flight booking problems,Flight Booking Problems
322,526700,241900,True,Sat Dec 02 06:48:29 +0000 2017,@Delta how sad that some people here have just accepted that things like this happen “when I fly @Delta”,526698,,2017-12-02,complaint,bad flight experience,Category: Bad Flight Experience.
330,535339,244030,True,Sat Dec 02 12:28:18 +0000 2017,"Flew more than enough miles on @Delta to make gold #skymiles next year, but didn’t spend enough $...  Last year I was within $250 but again penalized for being frugal? https://t.co/yfVSyqJACi",535338,,2017-12-02,complaint,flight booking problems,Flight Booking Problems
337,538117,244756,True,Sat Dec 02 14:09:31 +0000 2017,@Delta has the worst possible customer svc. Moved me from my paid seat without any knowledge,"538116,538118",,2017-12-02,complaint,poor customer service,Category: Poor Customer Service.
348,540379,245366,True,Sat Dec 02 14:57:53 +0000 2017,@Delta flight 1415 is over an hour late because you can't find the 2nd pilot. Nice way to treat your customers.,540378,,2017-12-02,complaint,flight delays,Category: Flight Delays.
350,540383,245368,True,Sat Dec 02 15:11:20 +0000 2017,@Delta I can’t believe you reseated me today on an international flight to a much worse seat. Pathetic customer service.,540382,,2017-12-02,complaint,poor customer service,Category: Poor Customer Service
351,540386,245369,True,Sat Dec 02 15:08:37 +0000 2017,@Delta @824 past 2 times I have flown out of GSP flight has messed up by faulty plane.  What’s the deal?  Then I call needing help re-routing and it will be 40 minutes before I can get a call back?  You can do better.,540384,,2017-12-02,complaint,flight delays,"Categories: Flight Delays, Poor Customer Service."
354,538094,244751,True,Sat Dec 02 14:16:34 +0000 2017,@Delta help! I requested to be upgraded to comfort for flight 861 from SLC to EWR this morning. I am showing only on the first class upgrade list which has 21 people ahead of me. Please advise asap.,"538095,538093",,2017-12-02,complaint,flight booking problems,Category: Flight Booking Problems
356,535349,244033,True,Sat Dec 02 12:22:39 +0000 2017,@delta who do I submit my complaint to regarding my flight experience two days ago?,535348,,2017-12-02,Category: Complaint,,Flight Experience Complaint.
357,536127,202942,True,Sat Dec 02 13:18:58 +0000 2017,"Sorry, @Delta. I'm bitter your system preselects your seat when upgraded. So instead of a window seat on a bumpy red-eye flight this morning, I had a middle seat on a skinny 757 seat. Really wish it'd go back to how it used to be. Notify the upgrade, then log in and select.",536126,,2017-12-02,complaint,flight booking problems,Flight Booking Problems
358,536134,244215,True,Sat Dec 02 13:11:14 +0000 2017,@Delta been waiting with two little kids at JFK check in desk for 30 minutes supposedly because of new booking system for infants,536133,,2017-12-02,complaint,flight booking problems,Flight Booking Problems
359,536136,239999,True,Sat Dec 02 13:12:16 +0000 2017,@Delta It’s a shame that you had an opportunity to Win over the customer for a bad experience and chose not to.,536135,,2017-12-02,complaint,bad flight experience,Category: Bad Flight Experience.
362,536142,243600,True,Sat Dec 02 13:06:54 +0000 2017,"This is how @Delta treats first class, full fare travelers. In addition, they seem to like pounding club music blaring at unacceptable decibels during boarding. https://t.co/t1KGAj13lg",536141,,2017-12-02,complaint,bad flight experience,Category: Bad Flight Experience.
367,536987,243850,True,Sat Dec 02 13:33:27 +0000 2017,Apparently @Delta encourages military members not seeing their family,536982,,2017-12-02,complaint,poor customer service,Poor Customer Service.
368,536990,244463,True,Sat Dec 02 13:35:43 +0000 2017,"So much for #Delta Airlines free ""GoGo"" in-flight WiFi ... account signed-in &amp; it was allegedly connected to my mobile but no apps functional with it, no Internet access. @Delta Flight 2551 (Toronto - Atlanta) https://t.co/vLFIa6h9iC",536988,,2017-12-02,complaint,bad flight experience,Category: Bad Flight Experience.
372,538084,244749,True,Sat Dec 02 13:50:50 +0000 2017,"Shame on @Delta.... now the pilot “got pulled off”. Can’t leave till 12ish? If you told us at 6, I could have driven to DTW. https://t.co/oJ2vhSn5Nx","538083,538085",,2017-12-02,complaint,flight delays,Category: Flight Delays
374,514186,238386,True,Sat Dec 02 00:11:25 +0000 2017,"@Delta starting our trip on a bad note. Over 2 delay to fix a hose. It took 45 minutes for paperwork. Now we are stranded in Atlanta because we missed our connection flight to Munich. We got on a later flight through Paris (yeah, one more stop) but our party got split up as well.",514185,,2017-12-02,complaint,flight delays,Category: Flight Delays
383,516812,239132,True,Sat Dec 02 01:05:07 +0000 2017,@DELTA I can see empty gates but we're stuck on the tarmac. Thanks!!,516811,,2017-12-02,complaint,flight delays,Category: Flight Delays
384,516821,239135,True,Sat Dec 02 01:04:16 +0000 2017,@AmericanAir you must not want me as a member of your sky miles.  I had a death in the family and you ppl cancelled the only flight to ct!!  I swear to god you better make this right or i am switching to @Delta,516820,,2017-12-02,complaint,flight cancellation,Category: Flight Cancellation
385,516828,238750,True,Sat Dec 02 00:58:23 +0000 2017,.@Delta now you're boarding employees before me?! What in the literal hell are you doing? My confirmed seat was given up?,"516826,516829",,2017-12-02,complaint,flight booking problems,Flight Booking Problems
386,517822,239414,True,Sat Dec 02 01:26:35 +0000 2017,"@Delta you app won’t allow option to select seats, then I hold for 56 minutes, and the rep all of a sudden can’t hear me? I don’t buy it!!",517821,,2017-12-02,complaint,flight booking problems,Flight Booking Problems
392,517811,239411,True,Sat Dec 02 01:36:10 +0000 2017,"@Delta @824 #disappointed my mom tried to surprise me by upgrading our seats, back in august mind you, 💺 and they separated us the day before our flight to Rome, Italy 🇮🇹!😢😭 #crushed #nothappy",517809,,2017-12-02,complaint,flight booking problems,Category: Flight Booking Problems.
396,514177,238383,True,Sat Dec 02 00:15:26 +0000 2017,"Tasha was helpful. The other lady was rude. Because of that, the @delta flt w room for all of us filled up. #flyingsolonow #hopeweallmakeit #deltadoesntcare",514175,,2017-12-02,complaint,poor customer service,Poor Customer Service.
397,514180,238384,True,Sat Dec 02 00:16:25 +0000 2017,@Delta I flew you all for thanksgiving round trip DC to LA and I have a bone to pick with you all!,514179,,2017-12-02,complaint,bad flight experience,Bad Flight Experience.
398,516800,239129,True,Sat Dec 02 01:15:23 +0000 2017,Maybe just don't give an estimate until you know what the solution to the mechanical problem is? @Delta https://t.co/tSlMd1bj1V,516799,,2017-12-02,complaint,flight delays,Flight Delays
399,540397,245372,True,Sat Dec 02 15:02:18 +0000 2017,@Delta 40 min delay on runway in VPS has tripled my travel time today. Anything you can do?,540396,,2017-12-02,complaint,flight delays,Category: Flight Delays.
400,515515,238757,True,Sat Dec 02 00:19:50 +0000 2017,@Delta The first time I have ever encountered a truly rude Delta flight attendant.  Ever.  Not wearing a name tag and won’t give out her name...but man.,515514,,2017-12-02,complaint,flight attendant complaints,Flight Attendant Complaints
401,515521,238759,True,Sat Dec 02 00:18:51 +0000 2017,Absolutely pathetic @delta are you ever on time leaving LGA?!? 6th in line for takeoff when we are already almost delayed 2 hours.,515520,,2017-12-02,complaint,flight delays,Category: Flight Delays
402,515523,238760,True,Sat Dec 02 00:15:24 +0000 2017,@delta your staff are so rude 🙄🙄,515522,,2017-12-02,complaint,poor customer service,Category: Poor Customer Service
405,516789,239127,True,Sat Dec 02 01:22:18 +0000 2017,@Delta stop trying to sling credit cards as I watch HBO.,516788,,2017-12-02,complaint,other,Other.
410,515498,238751,True,Sat Dec 02 00:47:14 +0000 2017,"Hey @Delta, your fancy new overhead bins make it very hard for vertically challenged folks to put up their own bags. Just saying.",515496,,2017-12-02,complaint,bad flight experience,Bad Flight Experience.
411,515495,238750,True,Sat Dec 02 00:42:20 +0000 2017,".@Delta how does a confirmed silver medallion passenger lose a seat and get stuck waiting due to a ""glitch""?",515491,,2017-12-02,complaint,flight booking problems,Flight Booking Problems
413,515484,223761,True,Sat Dec 02 00:48:20 +0000 2017,@Delta You guys need to do something about your electrical outlets. I’m on a plane that was new in February (Ship 3873) and the outlets are already too loose to use reliably.,515482,,2017-12-02,complaint,bad flight experience,Bad Flight Experience.
417,518971,239738,True,Sat Dec 02 02:17:31 +0000 2017,@Delta really? A maintenance delay &amp; gate change? Why aren’t realistic times gates posted? Johnson 1005909310,"518968,518975",,2017-12-02,complaint,flight delays,Category: Flight Delays
420,520882,240253,True,Sat Dec 02 03:05:59 +0000 2017,@Delta all that sass your flight attendants had rushing us to take our seats. We seated and ready to go and now the plane needs fuel. Like who forgot that lol WE LATE FOREAL NOW,520881,,2017-12-02,complaint,flight delays,Category: Flight Delays.
422,520889,240257,True,Sat Dec 02 00:14:53 +0000 2017,@Delta worst time ever flying from @240258. Delayed no reason. Missed connection flight. very rude employee “station manager” on flight,520888,,2017-12-02,complaint,flight delays,Category: Flight Delays and Poor Customer Service.
428,522762,240756,True,Sat Dec 02 04:10:13 +0000 2017,Hey @Delta you left our car seat &amp; luggage in EWR now we r in OKC.  What 2 do till luggage arrives?  Will you reimbrse xpnses. Agnts say no!,"522759,522763",,2017-12-02,complaint,lost/damaged luggage,Lost/Damaged Luggage
429,518981,239739,True,Sat Dec 02 02:02:13 +0000 2017,@delta FIX THE B SKYCLUB WIFI AND CELL RECEPTION!!!!!,518980,,2017-12-02,complaint,bad flight experience,Category: Bad Flight Experience.
431,522770,240757,True,Sat Dec 02 03:50:59 +0000 2017,@Delta your wait time to change a password for my sky miles account is nearing the point of ridiculous. #justsayin #stillwaiting,522768,,2017-12-02,complaint,flight booking problems,Flight Booking Problems
432,522772,240758,True,Sat Dec 02 04:04:32 +0000 2017,Why hasn't @Delta added the call back feature to their services? This 2 hour wait on hold is ridiculous.,522771,,2017-12-02,complaint,poor customer service,Category: Poor Customer Service.
434,523625,134257,True,Sat Dec 02 04:53:38 +0000 2017,"I've been trying to book a flight &amp; your website keeps saying ""initializing"" for the past hour @Delta 😒✈️",523624,,2017-12-02,complaint,flight booking problems,Flight Booking Problems
435,523628,241004,True,Sat Dec 02 04:43:03 +0000 2017,Wow @Delta been waiting at MCO for over and hour and a half. Bag was lost. Had places to be and rides waiting. I’ll be expecting a refund or round trip flight. Or you won’t be expecting my patronage again.,"523626,523630",,2017-12-02,complaint,lost/damaged luggage,Lost/Damaged Luggage.
436,523632,241005,True,Sat Dec 02 04:48:34 +0000 2017,"@Delta Husband and I both mileage members, pay $200/yr for Delta Amex cards, spend $5K+ per month on Delta Amex and now you want to charge me $100 just so I can sit next to my husband on our flights?",523631,,2017-12-02,complaint,flight booking problems,Flight Booking Problems
438,519979,145567,True,Sat Dec 02 02:26:53 +0000 2017,@Delta been waiting over 5 hr for help with account numerous calls with 2 hour waits and no promised call back and think 2 hr on hold times is rediculous,519977,,2017-12-02,complaint,poor customer service,Category: Poor Customer Service
439,519976,240009,True,Sat Dec 02 02:27:40 +0000 2017,"@Delta 2 hour flight delay. Weather’s fine. No excuse. Arriving past midnight. No apologies, no compensation. Thanks. For horrible service.",519975,,2017-12-02,complaint,flight delays,Category: Flight Delays
