,tweet_id,author_id,inbound,created_at,text,response_tweet_id,in_response_to_tweet_id,date,category_raw,category,complaint_category_raw
442,518983,239740,True,Sat Dec 02 02:22:28 +0000 2017,"@Delta worst customer service ever. Vicky yelled at us, interrupted us, was rude. Chris hung up on a conference call with us/WestJet/choiceair because “it’s not deltas fault”. Yes it was. Admit when you’re wrong and find a solution. After 14 hours, @136906 saved the day for us.",518982,,2017-12-02,complaint,poor customer service,Poor Customer Service
443,518986,239741,True,Sat Dec 02 02:17:44 +0000 2017,Ok @Delta I have become a big fan. Customer service has greatly improved but today a step back. Told to check bag at gate due to full bins. On flight and plenty of room in luggage bins. #sadtrombone https://t.co/i8hGSyLiYa,518984,,2017-12-02,complaint,poor customer service,Category: Poor Customer Service
446,518994,239743,True,Sat Dec 02 02:14:42 +0000 2017,Many airline gate agents are most helpful; some couldn’t care less. The guy at ATL C33 is in the latter group. @Delta #roadwarriorprobs,518993,,2017-12-02,complaint,poor customer service,Poor Customer Service.
447,518996,239744,True,Sat Dec 02 02:06:21 +0000 2017,@Delta all the flight that I've been on today or been scheduled to be (had to rearrange my flights twice already) have been delayed... what gives huh?,518995,,2017-12-02,complaint,flight delays,Category: Flight Delays
448,519006,239745,True,Sat Dec 02 02:07:50 +0000 2017,@Delta my 1st class seat just got stuck in a very uncomfortable position 30 min into flight. FA's unhelpful. Can you pls reach out for compensation? #delta https://t.co/gS8k4OrObU,"519005,519007",,2017-12-02,complaint,bad flight experience,Category: Bad Flight Experience.
449,519013,239746,True,Sat Dec 02 00:44:07 +0000 2017,"@Delta looking for assistance with a travel interruption due to a medical emergency.   Been on the phone lines, but nothing yet... Could you check DM's?  Thank you!",519009,,2017-12-02,category: complaint,flight booking problems,Flight Booking Problems
450,519933,239999,True,Sat Dec 02 02:55:43 +0000 2017,@Delta Very unpleasant flight from PDX to AMS on Nov3017. Husbands video player was broken and it was the hottest flight.  No air.  Miserable!,519930,,2017-12-02,complaint,bad flight experience,Category: Bad Flight Experience.
451,519937,240000,True,Sat Dec 02 02:51:28 +0000 2017,@delta help! my bag DL403030 was sent to baggage claim instead of my connecting flight. How do I get it home?,519935,,2017-12-02,category: complaint,lost/damaged luggage,Lost/Damaged Luggage.
454,519948,240003,True,Sat Dec 02 02:44:06 +0000 2017,"@Delta every time I travel with you there is a delay, over an hour this time and the only beverage passed out was pretty filled water cups ???",519947,,2017-12-02,complaint,flight delays,Category: Flight Delays
455,519951,240004,True,Sat Dec 02 02:43:53 +0000 2017,"@Delta so only h2o in delta comfort now on a 1:10 flt. Thanks for “upgrading” me from my preferred window seat to the middle and I can’t even get an OJ when I asked then a rude flt attendant that told me to “fly AA”. Thanks, think I will next year. Glad to know my 25k$ is nothing","519949,519953",,2017-12-02,complaint,bad flight experience,Category: Bad Flight Experience.
456,519961,240005,True,Sat Dec 02 02:36:50 +0000 2017,@Delta Why is there a 2HR wait time to talk to an agent,519957,,2017-12-02,complaint,poor customer service,Category: Poor Customer Service.
458,519967,240007,True,Sat Dec 02 02:37:55 +0000 2017,Would it even be a @Delta flight if it wasn’t delayed??,519965,,2017-12-02,complaint,flight delays,Category: Flight Delays
459,540395,167971,True,Sat Dec 02 14:51:34 +0000 2017,It doesn’t count as an early arrival @Delta if we sit on the tarmac waiting to get to a gate for 15 minutes.,540394,,2017-12-02,complaint,flight delays,Category: Flight Delays
460,527213,242033,True,Sat Dec 02 07:14:50 +0000 2017,"Never flying @Delta again. 3 hrs before departure, just to wait an hour for them to start work. 😡","527212,527214",,2017-12-02,complaint,flight delays,Category: Flight Delays
464,558659,250538,True,Sat Dec 02 21:14:43 +0000 2017,"@Delta My flight has been canceled, can you explain my why",558658,,2017-12-02,Category: Complaint,flight cancellation,Category: Flight Cancellation
465,558661,250539,True,Sat Dec 02 21:06:49 +0000 2017,@Delta Why is it literally every time I fly from Atlanta there are mechanical issues with your planes? Makes me want to avoid ATL. DL1390,558660,,2017-12-02,complaint,flight delays,Category: Flight Delays
466,560026,250969,True,Sat Dec 02 22:17:21 +0000 2017,@Delta did a pretty good number on my @25567 copilot bag today. Desk agent wasn’t much help either when I asked what could be done to address my issue. https://t.co/b0eOyH0kkr,560025,,2017-12-02,complaint,lost/damaged luggage,Lost/Damaged Luggage.
470,560043,250975,True,Sat Dec 02 22:19:55 +0000 2017,"@Delta My direct flight to LAX just got changed to two connecting flights...this is not what I paid for. Can I get a refund, please?",560042,,2017-12-02,complaint,flight booking problems,Category: Flight Booking Problems
471,560069,250985,True,Sat Dec 02 21:41:06 +0000 2017,@delta please give me my luggage!!! Haiti customer service said to call back in 30 minutes or they would call back but now they turned off the phone...#Delta #DeltaAirlines #needmyluggage,560068,,2017-12-02,complaint,lost/damaged luggage,Lost/Damaged Luggage.
472,560047,250976,True,Sat Dec 02 21:54:06 +0000 2017,@Delta we are on flight 2177 from RSW to DTW.  Plane is out of vodka.  Need Help🍸🍸🍸,560046,,2017-12-02,complaint,bad flight experience,Category: Bad Flight Experience.
474,560052,250977,True,Sat Dec 02 22:14:42 +0000 2017,"Guys, don't fly @delta. But do enjoy the rest of your day. Thanks.","560050,560053",,2017-12-02,complaint,other,Category: Other. The tweet does not provide any specific reason for the complaint.
477,560062,250980,True,Sat Dec 02 21:19:00 +0000 2017,"How.... what.... why would it be double the price to go from Tampa to San Juan, PR vs Tampa to NYC over the same days during the Christmas holiday. The former being a trip that is half the time of the latter.... what’s up, @Delta? #pricegouging https://t.co/RWpOGE4NNp",560061,,2017-12-02,complaint,flight booking problems,Flight Booking Problems
496,557286,250132,True,Sat Dec 02 20:59:32 +0000 2017,"@Delta - Why does your ticket and website say different things about your baggage allowance? Tried speaking with your team to resolve, but they're equally clueless! https://t.co/Kldo3vxcXG",557285,,2017-12-02,Category: Complaint,flight booking problems,Flight Booking Problems
499,561013,251277,True,Sat Dec 02 22:54:13 +0000 2017,@Delta on a flight and none of the flight attendants noticed a woman talking on her phone after takeoff. I want to remain anonymous but more checking is needed.,561012,,2017-12-02,complaint,flight attendant complaints,Flight Attendant Complaints
506,563564,251285,True,Sat Dec 02 23:04:35 +0000 2017,"If your profile says pescatarian or vegetarian but @Delta doesn’t actually save you a meal based on your dietary restrictions, what is the point of having the profile?","563563,563565",,2017-12-02,complaint,flight attendant complaints,Flight Attendant Complaints
507,563567,251966,True,Sat Dec 02 23:34:28 +0000 2017,.@Delta switched my flight to Korean Air w/o telling me until I got to the counter. Here is my view from the end of the new line I now have to wait in. Won't be flying Delta again. https://t.co/iSbwCdewvg,563566,,2017-12-02,complaint,flight booking problems,Flight Booking Problems
509,565476,252523,True,Sat Dec 02 15:07:48 +0000 2017,As a Diamond member of @Delta I noticed that I frequently have a non working power and/or USB outlet.  Why does Delta not have these fixed!!  Had a non working power on my outbound and now on my return!,565475,,2017-12-02,complaint,bad flight experience,Bad Flight Experience.
510,561017,251278,True,Sat Dec 02 22:49:05 +0000 2017,"@Delta  I have been trying to cancel my flight and request a refund for now 3 hours. the screen keeps freezing at the final step, this is not acceptable",561016,,2017-12-02,complaint,flight booking problems,Category: Flight Booking Problems
512,569692,253713,True,Sat Dec 02 19:55:12 +0000 2017,@delta I want my $100 back.  Got worse seat assignment than family who didn’t pay extra.  They have SKY priority seating and are together. My husband and I who paid for seating assignment are not together and zone 3.  Pretty crappy paid service https://t.co/tLl202TJll,569691,,2017-12-02,complaint,poor customer service,Category: Poor Customer Service.
515,570547,253962,True,Sat Dec 02 16:53:56 +0000 2017,I am contemplating filing a complaint against @Delta for emotional distress and lost wages because of my missing luggage. How can I get on the plane and you leave my luggage behind? I got to my destination with nothing to wear the next day. And still waiting 24hrs later.,"570546,570548",,2017-12-02,complaint,lost/damaged luggage,Lost/Damaged Luggage.
516,571418,254237,True,Sat Dec 02 22:59:37 +0000 2017,@Delta - DTW to CDG - Platinum status but sitting next to a dog in coach - $3000k ticket and no upgrade #really?,571417,,2017-12-02,complaint,bad flight experience,Category: Bad Flight Experience.
520,562485,210478,True,Sat Dec 02 23:04:10 +0000 2017,ATL airport and we are delayed @Delta. I don't think I have ever made it out of here on time... Ever...,562484,,2017-12-02,complaint,flight delays,Category: Flight Delays
522,561019,127644,True,Sat Dec 02 22:49:43 +0000 2017,"@Delta @118580 Flight #4768
why can’t your gate personnel provide proper communications???",561018,,2017-12-02,complaint,flight delays,Category: Flight Delays
524,561025,127644,True,Sat Dec 02 22:40:49 +0000 2017,@Delta #4768 WHY can’t this airline get flight crews organized to show up and actually be on time!?!  #cx #fail.,561024,,2017-12-02,complaint,flight delays,Category: Flight Delays.
525,561028,251280,True,Sat Dec 02 22:42:43 +0000 2017,"@Delta An hour on the ground in ATL, still no gate. How is that possible? It’s a huge airport. #unacceptable  #customerslast?","561026,561030",,2017-12-02,complaint,flight delays,Category: Flight Delays
526,561033,244463,True,Sat Dec 02 22:40:59 +0000 2017,"Upon arrival in Roatán via #Delta flight 694 (via Atlanta), dismayed to see that #TSA opened my Pelican case of photo gear, no note placed inside as per regulations, items not put back correctly, lost / stole one approved lock entirely &amp; left other wide open. 😡😠 @Delta @120943 https://t.co/3OoFky6bks","561031,561035",,2017-12-02,complaint,lost/damaged luggage,Lost/Damaged Luggage.
527,561037,251282,True,Sat Dec 02 22:43:06 +0000 2017,@Delta trying to reach a specialist to change a flight-impossible to get someone who can help on the phone today and website has an “error”,561036,,2017-12-02,complaint,flight booking problems,Flight Booking Problems
528,561039,140543,True,Sat Dec 02 22:38:04 +0000 2017,@Delta y'all tickets cost way too much to not be able to transfer them a week ahead of time. This is ridiculous and borderline theft of my money.,"561038,561040",,2017-12-02,complaint,flight booking problems,Category: Flight Booking Problems
530,561044,251284,True,Sat Dec 02 22:36:06 +0000 2017,@Delta this is NOT what I thought I would be getting flying 1st Class with Delta.  You should be ashamed and NO FOOD either. https://t.co/rWAX7VGBPm,561043,,2017-12-02,complaint,bad flight experience,Category: Bad Flight Experience.
532,561050,251286,True,Sat Dec 02 22:06:49 +0000 2017,"@Delta just got rejected from AF lounge at IAD with recently purchased Executive Sky Club membership, flying PE on AF to CDG. Very disappointed in service, this will be my future travel itin. Refund?","561047,561051",,2017-12-02,complaint,flight booking problems,Flight Booking Problems
534,562477,251627,True,Sat Dec 02 23:19:56 +0000 2017,"@Delta LGA Flt 5600 this is extremely bad, 2nd trip back to bus gates- ground crew forgot to plug in power- lousy experience",562476,,2017-12-02,complaint,bad flight experience,Category: Bad Flight Experience
536,562481,251629,True,Sat Dec 02 23:12:00 +0000 2017,@Delta call time as a medallion is over 2 hours without an option for a call back. Please help!!! #Travel,562480,,2017-12-02,complaint,flight booking problems,Flight Booking Problems
537,554192,249310,True,Sat Dec 02 20:02:23 +0000 2017,"@Delta seriously? Two maintenance delays in one day? I always want to be safe but I'm tired, Delta. So ready to be home.",554190,,2017-12-02,complaint,flight delays,Category: Flight Delays
541,544614,246546,True,Sat Dec 02 16:27:46 +0000 2017,"Argh! My @delta flight times changed after I booked the trip (now the outgoing flight doesn't work) and I tried to change it on web and that system is garbage, dl'd the app-- same problem. On hold and the wait is 54-193 minutes. Wtf.",544613,,2017-12-02,complaint,flight booking problems,Flight Booking Problems
544,545957,246929,True,Sat Dec 02 17:20:18 +0000 2017,@Delta definitely not doing priority luggage first at JFK right now on flight 0047 from Amsterdam,545955,,2017-12-02,complaint,lost/damaged luggage,Lost/Damaged Luggage.
546,545966,246930,True,Sat Dec 02 17:13:46 +0000 2017,I need a courtesy flight to go see my Mom... mentality iNeed a vacation @Delta,545965,,2017-12-02,complaint,flight booking problems,Flight Booking Problems.
548,545972,246933,True,Sat Dec 02 17:05:55 +0000 2017,"@Delta If a person boards early do to a surgery, &amp; ur staff says they are going to help him-Don't ignore him, like u did my husband. A Man started serving first class drinks &amp; ignored my husband's request for help. I guess drinks are more important? #MSP to #MCO this AM. #delta",545971,,2017-12-02,complaint,bad flight experience,Category: Bad Flight Experience.
549,547234,247290,True,Sat Dec 02 17:43:07 +0000 2017,I'm running late please don't leave me @DELTA PLEAASSSSEEEEEEEE!!!!!,547233,,2017-12-02,category: complaint,flight delays,Category: Flight Delays
551,547205,247284,True,Sat Dec 02 17:53:46 +0000 2017,@DELTA why does it take 2 hours to speak to a rep .. I want to see if I can get on earlier flight standby,547203,,2017-12-02,complaint,flight booking problems,Flight Booking Problems
552,547216,247285,True,Sat Dec 02 17:54:19 +0000 2017,@32823 @Delta Wow. One of the worst customer service experiences I’ve ever had to endure.  Your Customer Service team needs a serious overhaul and re-training.  Investing in it just makes good business sense.  It’s clear you’re not doing so.,547212,,2017-12-02,complaint,poor customer service,Category: Poor Customer Service
553,547219,247286,True,Sat Dec 02 17:39:06 +0000 2017,@Delta flight 1528 my in seat video screen keep crashing and seat 2B and 2C are stuck in recline.  #Disappointed for all this money in first class... https://t.co/ZVPSfgDbXC,547218,,2017-12-02,complaint,bad flight experience,Category: Bad Flight Experience.
554,547223,247287,True,Sat Dec 02 17:43:33 +0000 2017,"@Delta I booked three flights months ago and made sure my wife, daughter and I were sitting together. Today I log in to your app and we’re sitting apart on all three flights and cannot change. What gives?",547220,,2017-12-02,complaint,flight booking problems,Flight Booking Problems
555,547226,247288,True,Sat Dec 02 17:47:10 +0000 2017,My @Delta flight just got moved up two hours and they have an hour and have wait time for the phone. This trip is starting out great.,"547225,547227",,2017-12-02,complaint,flight booking problems,Category: Flight Booking Problems
558,544607,132237,True,Sat Dec 02 16:48:51 +0000 2017,"I love you @Delta but this is now the 4th flight in a row with inoperable wifi, and now I can't even get anyone the phone.",544605,,2017-12-02,complaint,bad flight experience,Category: Bad Flight Experience.
559,544604,246544,True,Sat Dec 02 16:54:49 +0000 2017,@Delta I have called twice about my baggage that was delayed and supposed to be delivered this morning with no updates or answers. Please DM for help,544603,,2017-12-02,complaint,lost/damaged luggage,Lost/Damaged Luggage
564,541681,245695,True,Sat Dec 02 15:42:20 +0000 2017,@Delta received a call this morning that my bag was ready for pickup but now they cant find it. Tag DL843196. Please help,541680,,2017-12-02,complaint,lost/damaged luggage,Lost/Damaged Luggage.
565,541683,245696,True,Sat Dec 02 15:07:28 +0000 2017,@Delta Your flight crew was half an hour late and now we’ve been boarded &amp; sitting for half an hour. Scheduled to arrive at DTW 10 minutes after my connection begins boarding. Starting to get annoyed...,541682,,2017-12-02,complaint,flight delays,Category: Flight Delays
567,543152,246126,True,Sat Dec 02 13:42:18 +0000 2017,@delta tsa blocking sky priority line.   Help.  #missing flight,543151,,2017-12-02,complaint,flight delays,Category: Flight Delays
572,543166,246131,True,Sat Dec 02 16:03:27 +0000 2017,"@Delta New, upgraded WiFi has some bugs to be worked out — last week kept get kicked off during flight, today it wasn’t working at all; frustrating as a passenger who pays a subscription for monthly access...",543165,,2017-12-02,complaint,bad flight experience,Category: Bad Flight Experience
579,551372,248488,True,Sat Dec 02 18:53:17 +0000 2017,"Hey @Delta, this part of MSP makes me a little nervous - always a bit of a “Lord of The Flies” vibe down here. 

If you don’t hear from #PurdonNation for a while, send rescue party. https://t.co/trmMu13gxP","551371,551373,551374,551375",,2017-12-02,complaint,other,"Category: Other. 

This tweet does not seem to be a complaint about any of the airline's services or products. It is a humorous comment about a specific location in the airport."
581,551344,248481,True,Sat Dec 02 19:17:18 +0000 2017,@Delta wish Delta would waive change ticket fees for US servicemembers when we are moved to another post after ticket issue. I was charged $200,551343,,2017-12-02,complaint,flight booking problems,Flight Booking Problems
583,551355,248483,True,Sat Dec 02 19:16:45 +0000 2017,"Having quite a time with @Delta customer service. Wait more than an hour to speak w an agent. She doesn’t think she can help but when she puts me on hold again, call fails. No call back. So I’ll start again.","551353,551356",,2017-12-02,complaint,poor customer service,Poor Customer Service.
585,551361,248485,True,Sat Dec 02 19:01:14 +0000 2017,"@Delta in Canun and you cancelled my girlfriends flight for no reason thanks for nothing!!!
Rude staff, Horrible person ignoring me, unhelpful now I have to stay overnight in Atlanta terrible service.
I take several flights a year Delta are now bottom of my list.",551359,,2017-12-02,complaint,flight cancellation,"Reason for complaint: Flight Cancellation
Category: Flight Cancellation"
588,551336,248479,True,Sat Dec 02 19:14:47 +0000 2017,@Delta @824 is this really how you treat luggage that says FRAGILE? https://t.co/wyPUZ6OLUm,551334,,2017-12-02,complaint,lost/damaged luggage,Lost/Damaged Luggage.
589,552709,132237,True,Sat Dec 02 19:30:38 +0000 2017,"@Delta you need to review your partnership with gogo. They are not providing the service you believe they are. When it works it's subpar, and I'm now finding it's barely working at all. I've had multiple flight where the service is down. Make sure they aren't robbing you blind.","552710,552708",,2017-12-02,complaint,bad flight experience,Bad Flight Experience.
598,550079,248119,True,Sat Dec 02 18:33:45 +0000 2017,@Delta You have got to be kidding me with this hour wait time.,"550078,550080",,2017-12-02,complaint,poor customer service,Category: Poor Customer Service.
601,550075,248118,True,Sat Dec 02 18:33:13 +0000 2017,@Delta 2 hours to receive a call back or be on hold for two hours to change my flight tomorrow ? Wow that’s horrible customer service. Unacceptable.,"550074,550076,550077",,2017-12-02,complaint,flight booking problems,Category: Flight Booking Problems and Poor Customer Service.
603,548710,247707,True,Sat Dec 02 18:11:31 +0000 2017,@Delta do what are you going to do to make this right?,"548709,548711",,2017-12-02,complaint,other,"Category: Other. 

This tweet does not provide enough information to classify it into any of the given categories. It is a general complaint without any specific details about the issue."
608,548734,244761,True,Sat Dec 02 18:04:49 +0000 2017,What? no WiFi on this flight!!! Come on @delta,548733,,2017-12-02,complaint,bad flight experience,Bad Flight Experience.
609,550060,248113,True,Sat Dec 02 18:53:12 +0000 2017,"@Delta Hey guys, I'm seeing two charges on my account pending for one ticket.",550059,,2017-12-02,Category: Complaint,flight booking problems,Flight Booking Problems
610,550064,248114,True,Sat Dec 02 18:38:14 +0000 2017,Every time I fly @Delta they always have to announce that there is limited room/going to have to check bags. Immediately people start lining up to board the plane so they get a spot first. If my Delta Comfort+ seat doesn't have a reserved overhead we're going to have problems.,550063,,2017-12-02,complaint,bad flight experience,Category: Bad Flight Experience.
613,550073,248117,True,Sat Dec 02 18:38:01 +0000 2017,"@Delta Um, still waiting to get off our plane in Columbus, Ohio. Been sitting for over 15 minutes. What's the point of arriving early only to sit here waiting for a  jetway so we can deboard? Is this another breakdown in communication? I want off this plane! SOS!",550072,,2017-12-02,complaint,flight delays,Category: Flight Delays
615,479952,229059,True,Fri Dec 01 13:02:13 +0000 2017,@Delta bruh... https://t.co/xpSxiIA2vs,"479953,479951",,2017-12-01,complaint,other,other.
619,479010,228828,True,Fri Dec 01 12:44:50 +0000 2017,Thank you @Delta for not letting people at @122828 about the gate/terminal switch to LaGuardia. 😡 My aunt Charline and Uncle Louis missed their flight!!!! Bad business!,479007,,2017-12-01,complaint,flight booking problems,Category: Flight Booking Problems
620,479006,228827,True,Fri Dec 01 11:53:51 +0000 2017,@Delta not feeling sky priority is getting any priority this morning at T4 front end.,479005,,2017-12-01,complaint,flight delays,Flight Delays
621,479940,229056,True,Fri Dec 01 13:07:06 +0000 2017,@delta First time in &gt;100 flights that my KTN hasn’t registered properly in my airline’s system. Also first time I’ve flown Delta in a while. Guess I’m better off sticking with @AmericanAir,"479939,479941",,2017-12-01,complaint,flight booking problems,Flight Booking Problems
623,479947,229058,True,Fri Dec 01 13:15:00 +0000 2017,"@Delta  - on my recent eze-ATL flight, the purser said he’d issue me 30k miles on account of a broken seat and broken tv. Showed me on his device, but miles haven’t showed up. It’s been almost a week! Can you help?",479946,,2017-12-01,complaint,lost/damaged luggage,Lost/Damaged Luggage.
624,479949,228618,True,Fri Dec 01 13:10:52 +0000 2017,still waiting @Delta #nohelp 🖕🖕🖕 https://t.co/UpjjDng19O,479948,,2017-12-01,complaint,poor customer service,Category: Poor Customer Service.
628,479972,229063,True,Fri Dec 01 13:00:32 +0000 2017,@Delta Stuck at PWM since 4am.  No navigation in airplane and no one knows what is going on.  Called into customer support and they are offering no help as well.,479971,,2017-12-01,complaint,flight delays,Category: Flight Delays
631,481186,229373,True,Fri Dec 01 13:34:20 +0000 2017,"Having a zillion @Delta skymiles is nice, but being able to use them would be even nicer.","481185,481187",,2017-12-01,complaint,flight booking problems,Flight Booking Problems
635,481198,229375,True,Fri Dec 01 13:42:47 +0000 2017,@delta. Could you have @13709 or whoever is in charge of maintenance fix the outlets? https://t.co/a65qflQimr,481197,,2017-12-01,complaint,other,"Category: Other. 

The tweet is not related to any of the categories mentioned. The customer is simply requesting Delta to fix the outlets."
637,481200,229375,True,Fri Dec 01 13:37:57 +0000 2017,@delta flight delayed and no charging outlets work in terminal C gate 16.  One or the other would be nice.,481199,,2017-12-01,complaint,flight delays,Category: Flight Delays
639,479003,119024,True,Fri Dec 01 12:48:10 +0000 2017,Oh @Delta...cross-terminals connection today w/ negative time from arrival &amp; boarding? Ouch! https://t.co/bBhgC8vaBC,479001,,2017-12-01,complaint,flight delays,Flight Delays
640,477200,228405,True,Fri Dec 01 10:56:16 +0000 2017,Platinum Delta member but they upgrade crew bs @Delta https://t.co/jfwIF7uxfI,477197,,2017-12-01,complaint,flight attendant complaints,Flight Attendant Complaints
642,477204,228406,True,Fri Dec 01 10:50:38 +0000 2017,"@Delta I fly to Montreal for work almost every month and my return flight has never left on time. I mean it, never. Is mainline going to take over this route when the EXJ contract ends?",477202,,2017-12-01,complaint,flight delays,Category: Flight Delays
644,476586,138977,True,Fri Dec 01 11:19:30 +0000 2017,@Delta auto check in is ridiculous and now even more confusing with delayed auto check in.  Wow. Delta really is pushing the limits of company stupidity.  What more can DL get away with !?,476585,,2017-12-01,complaint,flight booking problems,Category: Flight Booking Problems
649,476594,228263,True,Fri Dec 01 10:25:39 +0000 2017,The 5:20a @Delta to ATL should be illegal. ✈️ MSP-ATL-OKC 😴 I have no one to blame but myself.,476593,,2017-12-01,complaint,flight delays,Category: Flight Delays
656,478193,228613,True,Fri Dec 01 12:19:40 +0000 2017,@Delta  gave me a buncha shit at the gate  I️ love you but you gotta do better,478192,,2017-12-01,complaint,poor customer service,Category: Poor Customer Service
657,478197,228614,True,Fri Dec 01 11:43:29 +0000 2017,"Fuck me up, @Delta. https://t.co/NqszEf5CXA",478196,,2017-12-01,complaint,other,Category: Other.
